[
  {
    "url": "https://cellphones.com.vn/laptop-asus-gaming-v16-v3607vm-rp044w.html",
    "name": "Laptop ASUS Gaming V16 V3607VM-RP044W",
    "price_int": 33690000,
    "category": "Laptop",
    "specs": {
      "Loại card đồ họa": "NVIDIA GeForce RTX 5060 8GB GDDR7Intel Graphics",
      "Dung lượng RAM": "16GB",
      "Loại RAM": "DDR5 SO-DIMM",
      "Số khe ram": "2 khe (1x 16GB, nâng cấp tối đa 32GB)",
      "Ổ cứng": "1TB M.2 NVMe PCIe 4.0 SSD",
      "Kích thước màn hình": "16 inches",
      "Công nghệ màn hình": "Độ sáng 300nitsĐộ phủ màu 45% NTSC Màn hình chống chói",
      "Pin": "63WHrs, 3S1P, 3-cell Li-ion",
      "Hệ điều hành": "Windows 11 Home",
      "Độ phân giải màn hình": "1920 x 1200 pixels (WUXGA)",
      "Loại CPU": "Intel Core 7 240H 2.5 GHz (24MB Cache, up to 5.2 GHz, 10 lõi, 16 luồng)",
      "Cổng giao tiếp": "1x USB 3.2 Gen 1 Type-C hỗ trợ hiển thị/cung cấp điện (5Gbps) 2x USB 3.2 Gen 1 Type-A (tốc độ dữ liệu lên đến 5Gbps) 1x HDMI 2.1 FRL 1x Giắc cắm âm thanh kết hợp 3.5mm 1x DC-in"
    },
    "rag_content": "Sản phẩm: Laptop ASUS Gaming V16 V3607VM-RP044W. Giá bán khoảng: 33,690,000 đồng. Cấu hình chi tiết: {\"Loại card đồ họa\": \"NVIDIA GeForce RTX 5060 8GB GDDR7Intel Graphics\", \"Dung lượng RAM\": \"16GB\", \"Loại RAM\": \"DDR5 SO-DIMM\", \"Số khe ram\": \"2 khe (1x 16GB, nâng cấp tối đa 32GB)\", \"Ổ cứng\": \"1TB M.2 NVMe PCIe 4.0 SSD\", \"Kích thước màn hình\": \"16 inches\", \"Công nghệ màn hình\": \"Độ sáng 300nitsĐộ phủ màu 45% NTSC Màn hình chống chói\", \"Pin\": \"63WHrs, 3S1P, 3-cell Li-ion\", \"Hệ điều hành\": \"Windows 11 Home\", \"Độ phân giải màn hình\": \"1920 x 1200 pixels (WUXGA)\", \"Loại CPU\": \"Intel Core 7 240H 2.5 GHz (24MB Cache, up to 5.2 GHz, 10 lõi, 16 luồng)\", \"Cổng giao tiếp\": \"1x USB 3.2 Gen 1 Type-C hỗ trợ hiển thị/cung cấp điện (5Gbps) 2x USB 3.2 Gen 1 Type-A (tốc độ dữ liệu lên đến 5Gbps) 1x HDMI 2.1 FRL 1x Giắc cắm âm thanh kết hợp 3.5mm 1x DC-in\"}. Tính năng nổi bật: "
  },
  {
    "url": "https://cellphones.com.vn/laptop-asus-gaming-v16-v3607vu-rp343w.html",
    "name": "Laptop ASUS Gaming V16 V3607VU-RP343W",
    "price_int": 23990000,
    "category": "Laptop",
    "specs": {
      "Loại card đồ họa": "NVIDIA GeForce RTX 4050 6GB GDDR6 (194 AI TOPs)Intel Graphics",
      "Dung lượng RAM": "16GB",
      "Loại RAM": "DDR5",
      "Số khe ram": "Có thể nâng cấp; Cần tháo vỏ dưới/trên",
      "Ổ cứng": "512GB M.2 NVMe PCIe 4.0 SSD",
      "Kích thước màn hình": "16 inches",
      "Công nghệ màn hình": "Màn hình chống chóiĐộ sáng 300nits Độ phủ màu 45% NTSC",
      "Pin": "63WHrs, 3S1P, 3-cell Li-ion",
      "Hệ điều hành": "Windows 11 Home",
      "Độ phân giải màn hình": "1920 x 1200 pixels (WUXGA)",
      "Loại CPU": "Intel Core 5 210H 2.2 GHz (12MB Cache, up to 4.8 GHz, 8 lõi, 12 luồng)",
      "Cổng giao tiếp": "1x USB 3.2 Gen 1 Type-C hỗ trợ hiển thị/sạc (5Gbps) 2x USB 3.2 Gen 1 Type-A (5Gbps) 1x HDMI 2.1 FRL 1x Giắc cắm âm thanh kết hợp 3.5mm 1x DC-in"
    },
    "rag_content": "Sản phẩm: Laptop ASUS Gaming V16 V3607VU-RP343W. Giá bán khoảng: 23,990,000 đồng. Cấu hình chi tiết: {\"Loại card đồ họa\": \"NVIDIA GeForce RTX 4050 6GB GDDR6 (194 AI TOPs)Intel Graphics\", \"Dung lượng RAM\": \"16GB\", \"Loại RAM\": \"DDR5\", \"Số khe ram\": \"Có thể nâng cấp; Cần tháo vỏ dưới/trên\", \"Ổ cứng\": \"512GB M.2 NVMe PCIe 4.0 SSD\", \"Kích thước màn hình\": \"16 inches\", \"Công nghệ màn hình\": \"Màn hình chống chóiĐộ sáng 300nits Độ phủ màu 45% NTSC\", \"Pin\": \"63WHrs, 3S1P, 3-cell Li-ion\", \"Hệ điều hành\": \"Windows 11 Home\", \"Độ phân giải màn hình\": \"1920 x 1200 pixels (WUXGA)\", \"Loại CPU\": \"Intel Core 5 210H 2.2 GHz (12MB Cache, up to 4.8 GHz, 8 lõi, 12 luồng)\", \"Cổng giao tiếp\": \"1x USB 3.2 Gen 1 Type-C hỗ trợ hiển thị/sạc (5Gbps) 2x USB 3.2 Gen 1 Type-A (5Gbps) 1x HDMI 2.1 FRL 1x Giắc cắm âm thanh kết hợp 3.5mm 1x DC-in\"}. Tính năng nổi bật: "
  },
  {
    "url": "https://cellphones.com.vn/laptop-asus-tuf-gaming-a15-fa506ncg-hn184w.html",
    "name": "Laptop ASUS TUF Gaming A15 FA506NCG-HN184W",
    "price_int": 20490000,
    "category": "Laptop",
    "specs": {
      "Loại card đồ họa": "NVIDIA GeForce RTX 3050 4GB GDDR6 Up to 1675MHz at 60W (75W with Dynamic Boost) AMD Radeon Graphics",
      "Dung lượng RAM": "16GB",
      "Loại RAM": "DDR5-5600 SO-DIMM",
      "Số khe ram": "2 khe (nâng cấp tối đa 64GB)",
      "Ổ cứng": "512GB PCIe 4.0 NVMe M.2 SSD )2 Khe cắm M.2 hỗ trợ cả SATA hoặc NVMe, tối đa 1TB)",
      "Kích thước màn hình": "15.6 inches",
      "Công nghệ màn hình": "Độ sáng 250nitsĐộ phủ màu NTSC 45% / SRGB 62.5% / Adobe 47.34%Màn hình chống chói Adaptive-Sync",
      "Pin": "48WHrs, 3S1P, 3-cell Li-ion",
      "Hệ điều hành": "Windows 11 Home",
      "Độ phân giải màn hình": "1920 x 1080 pixels (FullHD)",
      "Loại CPU": "AMD Ryzen 7 7445HS 3.2GHz (22MB Cache, up to 4.7GHz, 6 lõi, 12 luồng)",
      "Cổng giao tiếp": "1x cổng LAN RJ45 1x cổng USB 3.2 Gen 2 Type-C hỗ trợ DisplayPort (tốc độ dữ liệu lên đến 10Gbps) 3x cổng USB 3.2 Gen 1 Type-A (tốc độ dữ liệu lên đến 5Gbps) 1x cổng HDMI 2.1 TMDS1x 3.5mm Combo Audio Jack"
    },
    "rag_content": "Sản phẩm: Laptop ASUS TUF Gaming A15 FA506NCG-HN184W. Giá bán khoảng: 20,490,000 đồng. Cấu hình chi tiết: {\"Loại card đồ họa\": \"NVIDIA GeForce RTX 3050 4GB GDDR6 Up to 1675MHz at 60W (75W with Dynamic Boost) AMD Radeon Graphics\", \"Dung lượng RAM\": \"16GB\", \"Loại RAM\": \"DDR5-5600 SO-DIMM\", \"Số khe ram\": \"2 khe (nâng cấp tối đa 64GB)\", \"Ổ cứng\": \"512GB PCIe 4.0 NVMe M.2 SSD )2 Khe cắm M.2 hỗ trợ cả SATA hoặc NVMe, tối đa 1TB)\", \"Kích thước màn hình\": \"15.6 inches\", \"Công nghệ màn hình\": \"Độ sáng 250nitsĐộ phủ màu NTSC 45% / SRGB 62.5% / Adobe 47.34%Màn hình chống chói Adaptive-Sync\", \"Pin\": \"48WHrs, 3S1P, 3-cell Li-ion\", \"Hệ điều hành\": \"Windows 11 Home\", \"Độ phân giải màn hình\": \"1920 x 1080 pixels (FullHD)\", \"Loại CPU\": \"AMD Ryzen 7 7445HS 3.2GHz (22MB Cache, up to 4.7GHz, 6 lõi, 12 luồng)\", \"Cổng giao tiếp\": \"1x cổng LAN RJ45 1x cổng USB 3.2 Gen 2 Type-C hỗ trợ DisplayPort (tốc độ dữ liệu lên đến 10Gbps) 3x cổng USB 3.2 Gen 1 Type-A (tốc độ dữ liệu lên đến 5Gbps) 1x cổng HDMI 2.1 TMDS1x 3.5mm Combo Audio Jack\"}. Tính năng nổi bật: "
  },
  {
    "url": "https://cellphones.com.vn/laptop-asus-tuf-gaming-f16-fx607vj-rl034w.html",
    "name": "Laptop ASUS TUF Gaming F16 FX607VJ-RL034W",
    "price_int": 21790000,
    "category": "Laptop",
    "specs": {
      "Loại card đồ họa": "NVIDIA GeForce RTX 3050 6GB GDDR6Intel Iris Xe Graphics",
      "Dung lượng RAM": "16GB",
      "Loại RAM": "DDR4-3200 SO-DIMM",
      "Số khe ram": "2 khe (1 x 16GB, nâng cấp tối đa 64GB)",
      "Ổ cứng": "512GB PCIe 4.0 NVMe M.2 SSD (2 Khe cắm M.2 hỗ trợ SATA hoặc NVMe, tối đa 2TB)",
      "Kích thước màn hình": "16 inches",
      "Công nghệ màn hình": "Độ sáng 300nitsĐộ phủ màu NTSC 45%Màn hình chống chói",
      "Pin": "56WHrs, 4S1P, 4-cell Li-ion",
      "Hệ điều hành": "Windows 11 Home",
      "Độ phân giải màn hình": "1920 x 1200 pixels (WUXGA)",
      "Loại CPU": "Intel Core 5 210H 2.2 GHz (12MB Cache, up to 4.8 GHz, 8 lõi, 12 luồng)",
      "Cổng giao tiếp": "1x Cổng LAN RJ45 1x USB 3.2 Gen 2 Type-C hỗ trợ DisplayPort / cấp nguồn (tốc độ dữ liệu lên đến 10Gbps) 2x USB 3.2 Gen 1 Type-A (tốc độ dữ liệu lên đến 5Gbps) 1x HDMI 2.1 FRL1x 3.5mm Combo Audio Jack"
    },
    "rag_content": "Sản phẩm: Laptop ASUS TUF Gaming F16 FX607VJ-RL034W. Giá bán khoảng: 21,790,000 đồng. Cấu hình chi tiết: {\"Loại card đồ họa\": \"NVIDIA GeForce RTX 3050 6GB GDDR6Intel Iris Xe Graphics\", \"Dung lượng RAM\": \"16GB\", \"Loại RAM\": \"DDR4-3200 SO-DIMM\", \"Số khe ram\": \"2 khe (1 x 16GB, nâng cấp tối đa 64GB)\", \"Ổ cứng\": \"512GB PCIe 4.0 NVMe M.2 SSD (2 Khe cắm M.2 hỗ trợ SATA hoặc NVMe, tối đa 2TB)\", \"Kích thước màn hình\": \"16 inches\", \"Công nghệ màn hình\": \"Độ sáng 300nitsĐộ phủ màu NTSC 45%Màn hình chống chói\", \"Pin\": \"56WHrs, 4S1P, 4-cell Li-ion\", \"Hệ điều hành\": \"Windows 11 Home\", \"Độ phân giải màn hình\": \"1920 x 1200 pixels (WUXGA)\", \"Loại CPU\": \"Intel Core 5 210H 2.2 GHz (12MB Cache, up to 4.8 GHz, 8 lõi, 12 luồng)\", \"Cổng giao tiếp\": \"1x Cổng LAN RJ45 1x USB 3.2 Gen 2 Type-C hỗ trợ DisplayPort / cấp nguồn (tốc độ dữ liệu lên đến 10Gbps) 2x USB 3.2 Gen 1 Type-A (tốc độ dữ liệu lên đến 5Gbps) 1x HDMI 2.1 FRL1x 3.5mm Combo Audio Jack\"}. Tính năng nổi bật: "
  },
  {
    "url": "https://cellphones.com.vn/laptop-asus-tuf-gaming-f16-fx607vu-rl045w.html",
    "name": "Laptop ASUS TUF Gaming F16 FX607VU-RL045W",
    "price_int": 25990000,
    "category": "Laptop",
    "specs": {
      "Loại card đồ họa": "NVIDIA GeForce RTX 4050 6GB GDDR6 (194 AI TOPs) 2420MHz* at 140W (2370MHz Boost Clock+50MHz OC, 115W+25W Dynamic Boost) Intel Iris Xe Graphics",
      "Dung lượng RAM": "16GB",
      "Loại RAM": "DDR5-5600 SO-DIMM, tốc độ bộ nhớ của hệ thống thay đổi tùy theo CPU",
      "Số khe ram": "2x SO-DIMM (Tối đa 64GB)",
      "Ổ cứng": "512GB PCIe 4.0 NVMe M.2 SSD (2 Khe cắm M.2 hỗ trợ SATA hoặc NVMe, tối đa 2TB)",
      "Kích thước màn hình": "16 inches",
      "Công nghệ màn hình": "Độ sáng 300nitsĐộ phủ màu 45%Màn hình chống chóiG-Sync",
      "Pin": "56WHrs, 4S1P, 4-cell Li-ionSạc lại từ 0-50% trong 30 phút",
      "Hệ điều hành": "Windows 11 Home",
      "Độ phân giải màn hình": "1920 x 1200 pixels (FullHD+)",
      "Loại CPU": "Intel Core 5 210H 2.2 GHz (12MB Cache, up to 4.8 GHz, 8 lõi, 12 luồng)",
      "Cổng giao tiếp": "1x LAN RJ45 1x Thunderbolt 4 hỗ trợ DisplayPort (40Gbps) 1x USB 3.2 Gen 2 Type-C hỗ trợ DisplayPort / Sạc / G-SYNC (10Gbps) 2x USB 3.2 Gen 1 Type-A (5Gbps) 1x HDMI 2.1 FRL 1x Giắc cắm âm thanh kết hợp 3.5mm Micrô mảng tích hợp"
    },
    "rag_content": "Sản phẩm: Laptop ASUS TUF Gaming F16 FX607VU-RL045W. Giá bán khoảng: 25,990,000 đồng. Cấu hình chi tiết: {\"Loại card đồ họa\": \"NVIDIA GeForce RTX 4050 6GB GDDR6 (194 AI TOPs) 2420MHz* at 140W (2370MHz Boost Clock+50MHz OC, 115W+25W Dynamic Boost) Intel Iris Xe Graphics\", \"Dung lượng RAM\": \"16GB\", \"Loại RAM\": \"DDR5-5600 SO-DIMM, tốc độ bộ nhớ của hệ thống thay đổi tùy theo CPU\", \"Số khe ram\": \"2x SO-DIMM (Tối đa 64GB)\", \"Ổ cứng\": \"512GB PCIe 4.0 NVMe M.2 SSD (2 Khe cắm M.2 hỗ trợ SATA hoặc NVMe, tối đa 2TB)\", \"Kích thước màn hình\": \"16 inches\", \"Công nghệ màn hình\": \"Độ sáng 300nitsĐộ phủ màu 45%Màn hình chống chóiG-Sync\", \"Pin\": \"56WHrs, 4S1P, 4-cell Li-ionSạc lại từ 0-50% trong 30 phút\", \"Hệ điều hành\": \"Windows 11 Home\", \"Độ phân giải màn hình\": \"1920 x 1200 pixels (FullHD+)\", \"Loại CPU\": \"Intel Core 5 210H 2.2 GHz (12MB Cache, up to 4.8 GHz, 8 lõi, 12 luồng)\", \"Cổng giao tiếp\": \"1x LAN RJ45 1x Thunderbolt 4 hỗ trợ DisplayPort (40Gbps) 1x USB 3.2 Gen 2 Type-C hỗ trợ DisplayPort / Sạc / G-SYNC (10Gbps) 2x USB 3.2 Gen 1 Type-A (5Gbps) 1x HDMI 2.1 FRL 1x Giắc cắm âm thanh kết hợp 3.5mm Micrô mảng tích hợp\"}. Tính năng nổi bật: "
  },
  {
    "url": "https://cellphones.com.vn/laptop-asus-tuf-gaming-f16-fx608jhr-rv037w.html",
    "name": "Laptop ASUS TUF Gaming F16 FX608JHR-RV037W",
    "price_int": 33990000,
    "category": "Laptop",
    "specs": {
      "Loại card đồ họa": "NVIDIA GeForce RTX 5050 8GB GDDR7 115W (100W+15W)Intel UHD Graphics",
      "Dung lượng RAM": "16GB",
      "Loại RAM": "DDR5-5600 SO-DIMM",
      "Số khe ram": "2 khe (1 x 16GB, nâng cấp tối đa 32GB)",
      "Ổ cứng": "1TB PCIe 4.0 NVMe M.2 SSD (2 Khe cắm M.2 hỗ trợ SATA hoặc NVMe, tối đa 2TB)",
      "Kích thước màn hình": "16 inches",
      "Công nghệ màn hình": "Độ sáng 300 nits Độ phủ màu NTSC 72.00%, SRGB 100.00%, Adobe 75.35% Màn hình chống chói G-Sync",
      "Pin": "90WHrs, 4S1P, 4-cell Li-ion",
      "Hệ điều hành": "Windows 11 Home",
      "Độ phân giải màn hình": "1920 x 1200 pixels (WUXGA)",
      "Loại CPU": "Intel Core i7 14650HX 2.2 GHz (30MB Cache, up to 5.2 GHz, 16 lõi, 24 luồng)",
      "Cổng giao tiếp": "1x Cổng LAN RJ45 1x Thunderbolt 4 hỗ trợ DisplayPort / G-SYNC (40Gbps) 1x USB 3.2 Gen 2 Type-C hỗ trợ DisplayPort / cung cấp điện (10Gbps) 3x USB 3.2 Gen 2 Type-A (10Gbps) 1x HDMI 2.1 FRL 1x Giắc cắm âm thanh kết hợp 3.5mm"
    },
    "rag_content": "Sản phẩm: Laptop ASUS TUF Gaming F16 FX608JHR-RV037W. Giá bán khoảng: 33,990,000 đồng. Cấu hình chi tiết: {\"Loại card đồ họa\": \"NVIDIA GeForce RTX 5050 8GB GDDR7 115W (100W+15W)Intel UHD Graphics\", \"Dung lượng RAM\": \"16GB\", \"Loại RAM\": \"DDR5-5600 SO-DIMM\", \"Số khe ram\": \"2 khe (1 x 16GB, nâng cấp tối đa 32GB)\", \"Ổ cứng\": \"1TB PCIe 4.0 NVMe M.2 SSD (2 Khe cắm M.2 hỗ trợ SATA hoặc NVMe, tối đa 2TB)\", \"Kích thước màn hình\": \"16 inches\", \"Công nghệ màn hình\": \"Độ sáng 300 nits Độ phủ màu NTSC 72.00%, SRGB 100.00%, Adobe 75.35% Màn hình chống chói G-Sync\", \"Pin\": \"90WHrs, 4S1P, 4-cell Li-ion\", \"Hệ điều hành\": \"Windows 11 Home\", \"Độ phân giải màn hình\": \"1920 x 1200 pixels (WUXGA)\", \"Loại CPU\": \"Intel Core i7 14650HX 2.2 GHz (30MB Cache, up to 5.2 GHz, 16 lõi, 24 luồng)\", \"Cổng giao tiếp\": \"1x Cổng LAN RJ45 1x Thunderbolt 4 hỗ trợ DisplayPort / G-SYNC (40Gbps) 1x USB 3.2 Gen 2 Type-C hỗ trợ DisplayPort / cung cấp điện (10Gbps) 3x USB 3.2 Gen 2 Type-A (10Gbps) 1x HDMI 2.1 FRL 1x Giắc cắm âm thanh kết hợp 3.5mm\"}. Tính năng nổi bật: "
  },
  {
    "url": "https://cellphones.com.vn/laptop-asus-vivobook-14-x1405va-ly623w.html",
    "name": "Laptop ASUS Vivobook 14 X1405VA-LY623W",
    "price_int": 15390000,
    "category": "Laptop",
    "specs": {
      "Loại card đồ họa": "Intel UHD Graphics",
      "Dung lượng RAM": "16GB",
      "Loại RAM": "DDR4",
      "Số khe ram": "8GB DDR4 on board + 8GB DDR4 SO-DIMM",
      "Ổ cứng": "512GB M.2 NVMe PCIe 4.0 SSD",
      "Kích thước màn hình": "14 inches",
      "Công nghệ màn hình": "Độ sáng 300nitsĐộ phủ màu 45% NTSCMàn hình chống chói",
      "Pin": "42WHrs, 3S1P, 3-cell Li-ion",
      "Hệ điều hành": "Windows 11 Home",
      "Độ phân giải màn hình": "1920 x 1200 pixels (WUXGA)",
      "Loại CPU": "Intel Core i5-13420H 2.1 GHz (12MB Cache, up to 4.6 GHz, 8 lõi, 12 luồng)",
      "Cổng giao tiếp": "1x USB 2.0 Type-A (tốc độ dữ liệu lên đến 480Mbps) 1x USB 3.2 Gen 1 Type-C hỗ trợ cấp nguồn (tốc độ dữ liệu lên đến 5Gbps) 2x USB 3.2 Gen 1 Type-A (tốc độ dữ liệu lên đến 5Gbps) 1x HDMI 1.4 1x Giắc cắm âm thanh kết hợp 3.5mm 1x DC-in"
    },
    "rag_content": "Sản phẩm: Laptop ASUS Vivobook 14 X1405VA-LY623W. Giá bán khoảng: 15,390,000 đồng. Cấu hình chi tiết: {\"Loại card đồ họa\": \"Intel UHD Graphics\", \"Dung lượng RAM\": \"16GB\", \"Loại RAM\": \"DDR4\", \"Số khe ram\": \"8GB DDR4 on board + 8GB DDR4 SO-DIMM\", \"Ổ cứng\": \"512GB M.2 NVMe PCIe 4.0 SSD\", \"Kích thước màn hình\": \"14 inches\", \"Công nghệ màn hình\": \"Độ sáng 300nitsĐộ phủ màu 45% NTSCMàn hình chống chói\", \"Pin\": \"42WHrs, 3S1P, 3-cell Li-ion\", \"Hệ điều hành\": \"Windows 11 Home\", \"Độ phân giải màn hình\": \"1920 x 1200 pixels (WUXGA)\", \"Loại CPU\": \"Intel Core i5-13420H 2.1 GHz (12MB Cache, up to 4.6 GHz, 8 lõi, 12 luồng)\", \"Cổng giao tiếp\": \"1x USB 2.0 Type-A (tốc độ dữ liệu lên đến 480Mbps) 1x USB 3.2 Gen 1 Type-C hỗ trợ cấp nguồn (tốc độ dữ liệu lên đến 5Gbps) 2x USB 3.2 Gen 1 Type-A (tốc độ dữ liệu lên đến 5Gbps) 1x HDMI 1.4 1x Giắc cắm âm thanh kết hợp 3.5mm 1x DC-in\"}. Tính năng nổi bật: "
  },
  {
    "url": "https://cellphones.com.vn/laptop-asus-vivobook-15-oled-a1505va-l1688w.html",
    "name": "Laptop ASUS Vivobook 15 OLED A1505VA-L1688W",
    "price_int": 19490000,
    "category": "Laptop",
    "specs": {
      "Loại card đồ họa": "Intel UHD Graphics",
      "Dung lượng RAM": "16GB",
      "Loại RAM": "DDR4",
      "Số khe ram": "2 khe (8GB DDR4 on board + 8GB DDR4 SO-DIMM)",
      "Ổ cứng": "512GB M.2 NVMe PCIe 4.0 SSD",
      "Kích thước màn hình": "15.6 inches",
      "Công nghệ màn hình": "Thời gian phản hồi 0.2ms Độ sáng tối đa 600nits HDR Độ phủ màu 100% DCI-P3 Gamut mapping HDR True Black 600 1.07 tỷ màu Giảm 70% ánh sáng xanh có hại Được chứng nhận bởi TÜV Rheinland Màn hình chăm sóc mắt SGS",
      "Pin": "50WHrs, 3S1P, 3-cell Li-ion",
      "Hệ điều hành": "Windows 11 Home",
      "Độ phân giải màn hình": "1920 x 1080 pixels (FullHD)",
      "Loại CPU": "Intel Core i7-13620H 2.4 GHz (24MB Cache, up to 4.9 GHz, 10 lõi, 16 luồng)",
      "Cổng giao tiếp": "1x USB 2.0 Type-A (tốc độ dữ liệu lên đến 480Mbps) 1x USB 3.2 Gen 1 Type-C hỗ trợ cấp nguồn (tốc độ dữ liệu lên đến 5Gbps) 2x USB 3.2 Gen 1 Type-A (tốc độ dữ liệu lên đến 5Gbps) 1x HDMI 1.4 1x Giắc cắm âm thanh kết hợp 3.5mm 1x DC-in"
    },
    "rag_content": "Sản phẩm: Laptop ASUS Vivobook 15 OLED A1505VA-L1688W. Giá bán khoảng: 19,490,000 đồng. Cấu hình chi tiết: {\"Loại card đồ họa\": \"Intel UHD Graphics\", \"Dung lượng RAM\": \"16GB\", \"Loại RAM\": \"DDR4\", \"Số khe ram\": \"2 khe (8GB DDR4 on board + 8GB DDR4 SO-DIMM)\", \"Ổ cứng\": \"512GB M.2 NVMe PCIe 4.0 SSD\", \"Kích thước màn hình\": \"15.6 inches\", \"Công nghệ màn hình\": \"Thời gian phản hồi 0.2ms Độ sáng tối đa 600nits HDR Độ phủ màu 100% DCI-P3 Gamut mapping HDR True Black 600 1.07 tỷ màu Giảm 70% ánh sáng xanh có hại Được chứng nhận bởi TÜV Rheinland Màn hình chăm sóc mắt SGS\", \"Pin\": \"50WHrs, 3S1P, 3-cell Li-ion\", \"Hệ điều hành\": \"Windows 11 Home\", \"Độ phân giải màn hình\": \"1920 x 1080 pixels (FullHD)\", \"Loại CPU\": \"Intel Core i7-13620H 2.4 GHz (24MB Cache, up to 4.9 GHz, 10 lõi, 16 luồng)\", \"Cổng giao tiếp\": \"1x USB 2.0 Type-A (tốc độ dữ liệu lên đến 480Mbps) 1x USB 3.2 Gen 1 Type-C hỗ trợ cấp nguồn (tốc độ dữ liệu lên đến 5Gbps) 2x USB 3.2 Gen 1 Type-A (tốc độ dữ liệu lên đến 5Gbps) 1x HDMI 1.4 1x Giắc cắm âm thanh kết hợp 3.5mm 1x DC-in\"}. Tính năng nổi bật: "
  },
  {
    "url": "https://cellphones.com.vn/laptop-asus-vivobook-15-x1502va-bq885w.html",
    "name": "Laptop ASUS Vivobook 15 X1502VA-BQ885W",
    "price_int": 15390000,
    "category": "Laptop",
    "specs": {
      "Loại card đồ họa": "Intel HD Graphics",
      "Dung lượng RAM": "16GB",
      "Loại RAM": "DDR4",
      "Số khe ram": "2 khe (8GB DDR4 on board + 8GB DDR4 SO-DIMM, Có thể nâng cấp; Cần tháo vỏ dưới/trên)",
      "Ổ cứng": "512GB M.2 NVMe PCIe 4.0 SSD",
      "Kích thước màn hình": "15.6 inches",
      "Công nghệ màn hình": "Độ sáng 250nitsĐộ phủ màu 45% NTSCMàn hình chống chóiTÜV Rheinland-certified",
      "Pin": "42WHrs, 3S1P, 3-cell Li-ion",
      "Hệ điều hành": "Windows 11 Home",
      "Độ phân giải màn hình": "1920 x 1080 pixels (FullHD)",
      "Loại CPU": "Intel Core i5-13420H 2.1 GHz (12MB Cache, up to 4.6 GHz, 8 lõi, 12 luồng)",
      "Cổng giao tiếp": "1x USB 2.0 Type-A (480Mbps) 1x USB 3.2 Gen 1 Type-C hỗ trợ cấp nguồn (5Gbps) 2x USB 3.2 Gen 1 Type-A (5Gbps) 1x HDMI 1.4 1x Giắc cắm âm thanh kết hợp 3.5mm 1x DC-in"
    },
    "rag_content": "Sản phẩm: Laptop ASUS Vivobook 15 X1502VA-BQ885W. Giá bán khoảng: 15,390,000 đồng. Cấu hình chi tiết: {\"Loại card đồ họa\": \"Intel HD Graphics\", \"Dung lượng RAM\": \"16GB\", \"Loại RAM\": \"DDR4\", \"Số khe ram\": \"2 khe (8GB DDR4 on board + 8GB DDR4 SO-DIMM, Có thể nâng cấp; Cần tháo vỏ dưới/trên)\", \"Ổ cứng\": \"512GB M.2 NVMe PCIe 4.0 SSD\", \"Kích thước màn hình\": \"15.6 inches\", \"Công nghệ màn hình\": \"Độ sáng 250nitsĐộ phủ màu 45% NTSCMàn hình chống chóiTÜV Rheinland-certified\", \"Pin\": \"42WHrs, 3S1P, 3-cell Li-ion\", \"Hệ điều hành\": \"Windows 11 Home\", \"Độ phân giải màn hình\": \"1920 x 1080 pixels (FullHD)\", \"Loại CPU\": \"Intel Core i5-13420H 2.1 GHz (12MB Cache, up to 4.6 GHz, 8 lõi, 12 luồng)\", \"Cổng giao tiếp\": \"1x USB 2.0 Type-A (480Mbps) 1x USB 3.2 Gen 1 Type-C hỗ trợ cấp nguồn (5Gbps) 2x USB 3.2 Gen 1 Type-A (5Gbps) 1x HDMI 1.4 1x Giắc cắm âm thanh kết hợp 3.5mm 1x DC-in\"}. Tính năng nổi bật: "
  },
  {
    "url": "https://cellphones.com.vn/laptop-asus-vivobook-16-a1607qa-mb067ws-snapdragon.html",
    "name": "Laptop ASUS Vivobook 16 A1607QA-MB067WS",
    "price_int": 16290000,
    "category": "Laptop",
    "specs": {
      "Chip AI": "Qualcomm Hexagon NPU up to 45TOPS",
      "Loại card đồ họa": "Qualcomm Adreno GPUTiến trình chip mới nên có thể không kết nối được với các thiết bị có driver cũ",
      "Dung lượng RAM": "16GB",
      "Loại RAM": "LPDDR5X Onboard",
      "Ổ cứng": "512GB M.2 NVMe PCIe 4.0 SSD",
      "Kích thước màn hình": "16 inches",
      "Công nghệ màn hình": "Độ sáng 300nitsĐộ phủ màu 45% NTSCMàn hình chống chói",
      "Pin": "50WHrs, 3S1P, 3-cell Li-ion",
      "Hệ điều hành": "Windows 11 Home + Microsoft Office Home 2024 + Microsoft 365 Basic",
      "Độ phân giải màn hình": "1920 x 1200 pixels (WUXGA)",
      "Loại CPU": "Snapdragon X X1 26 100 (30MB Cache, up to 2.97GHz, 8 lõi, 8 luồng)",
      "Cổng giao tiếp": "2x USB 3.2 Gen 1 Type-A (tốc độ dữ liệu lên đến 5Gbps) 2x USB 4.0 Gen 3 Type-C hỗ trợ hiển thị/cung cấp điện (tốc độ dữ liệu lên đến 40Gbps) 1x HDMI 2.1 TMDS 1x Giắc cắm âm thanh kết hợp 3.5mm"
    },
    "rag_content": "Sản phẩm: Laptop ASUS Vivobook 16 A1607QA-MB067WS. Giá bán khoảng: 16,290,000 đồng. Cấu hình chi tiết: {\"Chip AI\": \"Qualcomm Hexagon NPU up to 45TOPS\", \"Loại card đồ họa\": \"Qualcomm Adreno GPUTiến trình chip mới nên có thể không kết nối được với các thiết bị có driver cũ\", \"Dung lượng RAM\": \"16GB\", \"Loại RAM\": \"LPDDR5X Onboard\", \"Ổ cứng\": \"512GB M.2 NVMe PCIe 4.0 SSD\", \"Kích thước màn hình\": \"16 inches\", \"Công nghệ màn hình\": \"Độ sáng 300nitsĐộ phủ màu 45% NTSCMàn hình chống chói\", \"Pin\": \"50WHrs, 3S1P, 3-cell Li-ion\", \"Hệ điều hành\": \"Windows 11 Home + Microsoft Office Home 2024 + Microsoft 365 Basic\", \"Độ phân giải màn hình\": \"1920 x 1200 pixels (WUXGA)\", \"Loại CPU\": \"Snapdragon X X1 26 100 (30MB Cache, up to 2.97GHz, 8 lõi, 8 luồng)\", \"Cổng giao tiếp\": \"2x USB 3.2 Gen 1 Type-A (tốc độ dữ liệu lên đến 5Gbps) 2x USB 4.0 Gen 3 Type-C hỗ trợ hiển thị/cung cấp điện (tốc độ dữ liệu lên đến 40Gbps) 1x HDMI 2.1 TMDS 1x Giắc cắm âm thanh kết hợp 3.5mm\"}. Tính năng nổi bật: "
  },
  {
    "url": "https://cellphones.com.vn/laptop-asus-vivobook-16x-k3605vc-rp431w.html",
    "name": "Laptop ASUS Gaming Vivobook 16X K3605VC-RP431W",
    "price_int": 18990000,
    "category": "Laptop",
    "specs": {
      "Loại card đồ họa": "NVIDIA Geforce RTX 3050 4GB GDDR6 Intel UHD Graphics",
      "Dung lượng RAM": "16GB",
      "Loại RAM": "DDR4 SO-DIMM",
      "Số khe ram": "2 khe (8GB DDR4 on board + 8GB DDR4 SO-DIMM)",
      "Ổ cứng": "512GB M.2 NVMe PCIe 4.0 SSD",
      "Kích thước màn hình": "16 inches",
      "Công nghệ màn hình": "Độ sáng 300nitsĐộ phủ màu 45% NTSCMàn hình chống chóiTÜV Rheinland-certified",
      "Pin": "50WHrs, 3S1P, 3-cell Li-ion",
      "Hệ điều hành": "Windows 11 Home",
      "Độ phân giải màn hình": "1920 x 1200 pixels (WUXGA)",
      "Loại CPU": "Intel Core i5-13420H 2.1 GHz (12MB Cache, up to 4.6 GHz, 8 lõi, 12 luồng)",
      "Cổng giao tiếp": "1x USB 3.2 Gen 1 Type-C hỗ trợ cấp nguồn (5Gbps) 2x USB 3.2 Gen 1 Type-A (5Gbps) 1x HDMI 2.1 TMDS 1x Giắc cắm âm thanh kết hợp 3,5mm 1x DC-in Đầu đọc thẻ SD 4.0"
    },
    "rag_content": "Sản phẩm: Laptop ASUS Gaming Vivobook 16X K3605VC-RP431W. Giá bán khoảng: 18,990,000 đồng. Cấu hình chi tiết: {\"Loại card đồ họa\": \"NVIDIA Geforce RTX 3050 4GB GDDR6 Intel UHD Graphics\", \"Dung lượng RAM\": \"16GB\", \"Loại RAM\": \"DDR4 SO-DIMM\", \"Số khe ram\": \"2 khe (8GB DDR4 on board + 8GB DDR4 SO-DIMM)\", \"Ổ cứng\": \"512GB M.2 NVMe PCIe 4.0 SSD\", \"Kích thước màn hình\": \"16 inches\", \"Công nghệ màn hình\": \"Độ sáng 300nitsĐộ phủ màu 45% NTSCMàn hình chống chóiTÜV Rheinland-certified\", \"Pin\": \"50WHrs, 3S1P, 3-cell Li-ion\", \"Hệ điều hành\": \"Windows 11 Home\", \"Độ phân giải màn hình\": \"1920 x 1200 pixels (WUXGA)\", \"Loại CPU\": \"Intel Core i5-13420H 2.1 GHz (12MB Cache, up to 4.6 GHz, 8 lõi, 12 luồng)\", \"Cổng giao tiếp\": \"1x USB 3.2 Gen 1 Type-C hỗ trợ cấp nguồn (5Gbps) 2x USB 3.2 Gen 1 Type-A (5Gbps) 1x HDMI 2.1 TMDS 1x Giắc cắm âm thanh kết hợp 3,5mm 1x DC-in Đầu đọc thẻ SD 4.0\"}. Tính năng nổi bật: "
  },
  {
    "url": "https://cellphones.com.vn/laptop-asus-vivobook-go-14-e1404fa-eb482w.html",
    "name": "Laptop ASUS Vivobook Go 14 E1404FA-EB482W",
    "price_int": 13190000,
    "category": "Laptop",
    "specs": {
      "Loại card đồ họa": "AMD Radeon Graphics",
      "Dung lượng RAM": "16GB",
      "Loại RAM": "LPDDR5 Onboard",
      "Ổ cứng": "512GB M.2 NVMe PCIe 3.0 SSD",
      "Kích thước màn hình": "14 inches",
      "Công nghệ màn hình": "Độ sáng 250 nits Độ phủ màu 45% NTSC Màn hình chống chói",
      "Pin": "42WHrs, 3S1P, 3-cell Li-ion",
      "Hệ điều hành": "Windows 11 Home",
      "Độ phân giải màn hình": "1920 x 1080 pixels (FullHD)",
      "Loại CPU": "AMD Ryzen 5 7520U 2.8GHz (6MB Cache, up to 4.3GHz, 4 lõi, 8 luồng)",
      "Cổng giao tiếp": "1x USB 2.0 Type-A (tốc độ dữ liệu lên đến 480Mbps) 1x USB 3.2 Gen 1 Type-A (tốc độ dữ liệu lên đến 5Gbps) 1x USB 3.2 Gen 1 Type-C (tốc độ dữ liệu lên đến 5Gbps) 1x HDMI 1.4 1x Jack âm thanh kết hợp 3.5mm 1x DC-in"
    },
    "rag_content": "Sản phẩm: Laptop ASUS Vivobook Go 14 E1404FA-EB482W. Giá bán khoảng: 13,190,000 đồng. Cấu hình chi tiết: {\"Loại card đồ họa\": \"AMD Radeon Graphics\", \"Dung lượng RAM\": \"16GB\", \"Loại RAM\": \"LPDDR5 Onboard\", \"Ổ cứng\": \"512GB M.2 NVMe PCIe 3.0 SSD\", \"Kích thước màn hình\": \"14 inches\", \"Công nghệ màn hình\": \"Độ sáng 250 nits Độ phủ màu 45% NTSC Màn hình chống chói\", \"Pin\": \"42WHrs, 3S1P, 3-cell Li-ion\", \"Hệ điều hành\": \"Windows 11 Home\", \"Độ phân giải màn hình\": \"1920 x 1080 pixels (FullHD)\", \"Loại CPU\": \"AMD Ryzen 5 7520U 2.8GHz (6MB Cache, up to 4.3GHz, 4 lõi, 8 luồng)\", \"Cổng giao tiếp\": \"1x USB 2.0 Type-A (tốc độ dữ liệu lên đến 480Mbps) 1x USB 3.2 Gen 1 Type-A (tốc độ dữ liệu lên đến 5Gbps) 1x USB 3.2 Gen 1 Type-C (tốc độ dữ liệu lên đến 5Gbps) 1x HDMI 1.4 1x Jack âm thanh kết hợp 3.5mm 1x DC-in\"}. Tính năng nổi bật: "
  },
  {
    "url": "https://cellphones.com.vn/laptop-asus-vivobook-go-14-e1404fa-nk177w.html",
    "name": "Laptop ASUS VivoBook Go 14 E1404FA-NK177W",
    "price_int": 12790000,
    "category": "Laptop",
    "specs": {
      "Loại card đồ họa": "AMD Radeon Graphics",
      "Dung lượng RAM": "16GB",
      "Loại RAM": "LPDDR5 onboard",
      "Ổ cứng": "SSD 512GB M.2 NVMe PCIe 3.0",
      "Kích thước màn hình": "14 inches",
      "Công nghệ màn hình": "Tỉ lệ 16:9Độ sáng tối đa 250nits Độ phủ màu 45% NTSC Màn hình chống chóiCông nghệ LCD",
      "Pin": "42WHrs, 3S1P, Li-ion 3 cell",
      "Hệ điều hành": "Windows 11 Home",
      "Độ phân giải màn hình": "1920 x 1080 pixels (FullHD)",
      "Loại CPU": "AMD Ryzen 5 7520U (4MB cache, up to 4.3 GHz, 4 lõi/8 luồng)",
      "Cổng giao tiếp": "1 x USB 2.0 Type-A1 x USB 3.2 Gen 1 Type-A1 x USB 3.2 Gen 1 Type-C1 x HDMI 1.41 x Jack cắm tai nghe 3.5 mm1 x Đầu vào DC"
    },
    "rag_content": "Sản phẩm: Laptop ASUS VivoBook Go 14 E1404FA-NK177W. Giá bán khoảng: 12,790,000 đồng. Cấu hình chi tiết: {\"Loại card đồ họa\": \"AMD Radeon Graphics\", \"Dung lượng RAM\": \"16GB\", \"Loại RAM\": \"LPDDR5 onboard\", \"Ổ cứng\": \"SSD 512GB M.2 NVMe PCIe 3.0\", \"Kích thước màn hình\": \"14 inches\", \"Công nghệ màn hình\": \"Tỉ lệ 16:9Độ sáng tối đa 250nits Độ phủ màu 45% NTSC Màn hình chống chóiCông nghệ LCD\", \"Pin\": \"42WHrs, 3S1P, Li-ion 3 cell\", \"Hệ điều hành\": \"Windows 11 Home\", \"Độ phân giải màn hình\": \"1920 x 1080 pixels (FullHD)\", \"Loại CPU\": \"AMD Ryzen 5 7520U (4MB cache, up to 4.3 GHz, 4 lõi/8 luồng)\", \"Cổng giao tiếp\": \"1 x USB 2.0 Type-A1 x USB 3.2 Gen 1 Type-A1 x USB 3.2 Gen 1 Type-C1 x HDMI 1.41 x Jack cắm tai nghe 3.5 mm1 x Đầu vào DC\"}. Tính năng nổi bật: "
  },
  {
    "url": "https://cellphones.com.vn/laptop-asus-vivobook-go-15-e1504ga-bq1141w.html",
    "name": "Laptop ASUS Vivobook Go 15 E1504GA-BQ1141W",
    "price_int": 9490000,
    "category": "Laptop",
    "specs": {
      "Loại card đồ họa": "Intel UHD Graphics",
      "Dung lượng RAM": "8GB",
      "Loại RAM": "DDR4 Onboard",
      "Ổ cứng": "256G UFS 2.1",
      "Kích thước màn hình": "15.6 inches",
      "Công nghệ màn hình": "Độ sáng 250nits Độ phủ màu 45% NTSC Màn hình chống chói",
      "Pin": "42WHrs, 3S1P, 3-cell Li-ion",
      "Hệ điều hành": "Windows 11 Home",
      "Độ phân giải màn hình": "1920 x 1080 pixels (FullHD)",
      "Loại CPU": "Intel Core i3-N305 1.8 GHz (6MB Cache, up to 3.8 GHz, 8 lõi, 8 luồng)",
      "Cổng giao tiếp": "1x USB 2.0 Type-A (480Mbps) 1x USB 3.2 Gen 1 Type-A (5Gbps) 1x USB 3.2 Gen 1 Type-C (5Gbps) 1x HDMI 1.4 1x Giắc cắm âm thanh kết hợp 3.5mm 1x DC-in"
    },
    "rag_content": "Sản phẩm: Laptop ASUS Vivobook Go 15 E1504GA-BQ1141W. Giá bán khoảng: 9,490,000 đồng. Cấu hình chi tiết: {\"Loại card đồ họa\": \"Intel UHD Graphics\", \"Dung lượng RAM\": \"8GB\", \"Loại RAM\": \"DDR4 Onboard\", \"Ổ cứng\": \"256G UFS 2.1\", \"Kích thước màn hình\": \"15.6 inches\", \"Công nghệ màn hình\": \"Độ sáng 250nits Độ phủ màu 45% NTSC Màn hình chống chói\", \"Pin\": \"42WHrs, 3S1P, 3-cell Li-ion\", \"Hệ điều hành\": \"Windows 11 Home\", \"Độ phân giải màn hình\": \"1920 x 1080 pixels (FullHD)\", \"Loại CPU\": \"Intel Core i3-N305 1.8 GHz (6MB Cache, up to 3.8 GHz, 8 lõi, 8 luồng)\", \"Cổng giao tiếp\": \"1x USB 2.0 Type-A (480Mbps) 1x USB 3.2 Gen 1 Type-A (5Gbps) 1x USB 3.2 Gen 1 Type-C (5Gbps) 1x HDMI 1.4 1x Giắc cắm âm thanh kết hợp 3.5mm 1x DC-in\"}. Tính năng nổi bật: "
  },
  {
    "url": "https://cellphones.com.vn/laptop-asus-vivobook-s-14-flip-tp3402va-lz632w.html",
    "name": "Laptop ASUS Vivobook S 14 FLIP TP3402VA-LZ632W",
    "price_int": 19490000,
    "category": "Laptop",
    "specs": {
      "Loại card đồ họa": "Intel UHD Graphics",
      "Dung lượng RAM": "16GB",
      "Loại RAM": "DDR4",
      "Số khe ram": "8GB DDR4 on board + 8GB DDR4 SO-DIMM (Có thể nâng cấp; Cần tháo vỏ dưới/trên)",
      "Ổ cứng": "512GB M.2 NVMe PCIe 4.0 SSD",
      "Kích thước màn hình": "14 inches",
      "Công nghệ màn hình": "Độ sáng 300nitsĐộ phủ màu 45% NTSC TÜV Rheinland-certifiedWith stylus support",
      "Pin": "50WHrs, 3S1P, 3-cell Li-ion",
      "Hệ điều hành": "Windows 11 Home",
      "Độ phân giải màn hình": "1920 x 1200 pixels (WUXGA)",
      "Loại CPU": "Intel Core i5-13420H 2.1 GHz (12MB Cache, up to 4.6 GHz, 8 lõi, 12 luồng)",
      "Cổng giao tiếp": "1x USB 2.0 Type-A (480Mbps) 1x USB 3.2 Gen 2 Type-A (10Gbps) 1x USB 3.2 Gen 2 Type-C hỗ trợ hiển thị/cung cấp điện (10Gbps) 1x HDMI 2.1 TMDS 1x Giắc cắm âm thanh kết hợp 3.5mm 1x DC-in"
    },
    "rag_content": "Sản phẩm: Laptop ASUS Vivobook S 14 FLIP TP3402VA-LZ632W. Giá bán khoảng: 19,490,000 đồng. Cấu hình chi tiết: {\"Loại card đồ họa\": \"Intel UHD Graphics\", \"Dung lượng RAM\": \"16GB\", \"Loại RAM\": \"DDR4\", \"Số khe ram\": \"8GB DDR4 on board + 8GB DDR4 SO-DIMM (Có thể nâng cấp; Cần tháo vỏ dưới/trên)\", \"Ổ cứng\": \"512GB M.2 NVMe PCIe 4.0 SSD\", \"Kích thước màn hình\": \"14 inches\", \"Công nghệ màn hình\": \"Độ sáng 300nitsĐộ phủ màu 45% NTSC TÜV Rheinland-certifiedWith stylus support\", \"Pin\": \"50WHrs, 3S1P, 3-cell Li-ion\", \"Hệ điều hành\": \"Windows 11 Home\", \"Độ phân giải màn hình\": \"1920 x 1200 pixels (WUXGA)\", \"Loại CPU\": \"Intel Core i5-13420H 2.1 GHz (12MB Cache, up to 4.6 GHz, 8 lõi, 12 luồng)\", \"Cổng giao tiếp\": \"1x USB 2.0 Type-A (480Mbps) 1x USB 3.2 Gen 2 Type-A (10Gbps) 1x USB 3.2 Gen 2 Type-C hỗ trợ hiển thị/cung cấp điện (10Gbps) 1x HDMI 2.1 TMDS 1x Giắc cắm âm thanh kết hợp 3.5mm 1x DC-in\"}. Tính năng nổi bật: "
  },
  {
    "url": "https://cellphones.com.vn/laptop-asus-vivobook-s-14-oled-m5406wa-pp071ws.html",
    "name": "Laptop ASUS Vivobook S 14 OLED M5406WA-PP071WS",
    "price_int": 30390000,
    "category": "Laptop",
    "specs": {
      "Chip AI": "AMD XDNA NPU up to 50TOPS",
      "Loại card đồ họa": "AMD Radeon 890M Graphics",
      "Dung lượng RAM": "32GB",
      "Loại RAM": "LPDDR5X Onboard",
      "Ổ cứng": "1TB M.2 NVMe PCIe 4.0 SSD (1x M.2 2280 PCIe 3.0x4)",
      "Kích thước màn hình": "14 inches",
      "Công nghệ màn hình": "Độ sáng tối đa HDR 600nits Độ phủ màu DCI-P3 100% 1.000.000:1 Màn hình HDR True Black 600 ĐÃ CHỨNG NHẬN VESA 1.07 tỷ màu Được PANTONE xác thực Màn hình bóng Giảm 65% ánh sáng xanh có hại",
      "Pin": "75WHrs, 4S1P, 4-cell Li-ion",
      "Hệ điều hành": "Windows 11 Home + OFFICE",
      "Độ phân giải màn hình": "2880 x 1800 pixels",
      "Loại CPU": "AMD Ryzen AI 9 HX 370 2.0GHz (36MB Cache, up to 5.1GHz, 12 lõi, 24 luồng)",
      "Cổng giao tiếp": "1x USB 3.2 Gen 1 Type-C (Display / Sạc) 2x USB 3.2 Gen 1 Type-A 1x USB 4.0 Gen 3 Type-C (Display / Sạc) 1x HDMI 2.1 TMDS 1x 3.5mm Combo Audio Jack Micro SD card reader"
    },
    "rag_content": "Sản phẩm: Laptop ASUS Vivobook S 14 OLED M5406WA-PP071WS. Giá bán khoảng: 30,390,000 đồng. Cấu hình chi tiết: {\"Chip AI\": \"AMD XDNA NPU up to 50TOPS\", \"Loại card đồ họa\": \"AMD Radeon 890M Graphics\", \"Dung lượng RAM\": \"32GB\", \"Loại RAM\": \"LPDDR5X Onboard\", \"Ổ cứng\": \"1TB M.2 NVMe PCIe 4.0 SSD (1x M.2 2280 PCIe 3.0x4)\", \"Kích thước màn hình\": \"14 inches\", \"Công nghệ màn hình\": \"Độ sáng tối đa HDR 600nits Độ phủ màu DCI-P3 100% 1.000.000:1 Màn hình HDR True Black 600 ĐÃ CHỨNG NHẬN VESA 1.07 tỷ màu Được PANTONE xác thực Màn hình bóng Giảm 65% ánh sáng xanh có hại\", \"Pin\": \"75WHrs, 4S1P, 4-cell Li-ion\", \"Hệ điều hành\": \"Windows 11 Home + OFFICE\", \"Độ phân giải màn hình\": \"2880 x 1800 pixels\", \"Loại CPU\": \"AMD Ryzen AI 9 HX 370 2.0GHz (36MB Cache, up to 5.1GHz, 12 lõi, 24 luồng)\", \"Cổng giao tiếp\": \"1x USB 3.2 Gen 1 Type-C (Display / Sạc) 2x USB 3.2 Gen 1 Type-A 1x USB 4.0 Gen 3 Type-C (Display / Sạc) 1x HDMI 2.1 TMDS 1x 3.5mm Combo Audio Jack Micro SD card reader\"}. Tính năng nổi bật: "
  },
  {
    "url": "https://cellphones.com.vn/laptop-asus-vivobook-s14-s3407qa-sf043ws.html",
    "name": "Laptop ASUS Vivobook S14 S3407QA-SF043WS",
    "price_int": 18990000,
    "category": "Laptop",
    "specs": {
      "Chip AI": "Qualcomm Hexagon NPU up to 45TOPS",
      "Loại card đồ họa": "Qualcomm Adreno GPU",
      "Dung lượng RAM": "16GB",
      "Loại RAM": "LPDDR5X Onboard",
      "Ổ cứng": "512GB M.2 NVMe PCIe 4.0 SSD",
      "Kích thước màn hình": "14 inches",
      "Công nghệ màn hình": "Độ sáng 300 nits Độ phủ màu 95% DCI-P3 Tỷ lệ tương phản 1.000.000:1 1.07 tỷ màu Màn hình chống chói giảm 70% ánh sáng xanh có hại Được chứng nhận bởi TÜV Rheinland",
      "Pin": "70WHrs, 3S1P, 3-cell Li-ion",
      "Hệ điều hành": "Windows 11 Home + Microsoft Office Home 2024 + Microsoft 365 Basic",
      "Độ phân giải màn hình": "1920 x 1200 pixels",
      "Loại CPU": "Snapdragon X X1 26 100 (30MB Cache, up to 2.97GHz, 8 lõi, 8 luồng)",
      "Cổng giao tiếp": "2x USB 3.2 Gen 1 Type-A (tốc độ dữ liệu lên đến 5Gbps) 2x USB 4.0 Gen 3 Type-C hỗ trợ hiển thị/cấp nguồn (tốc độ dữ liệu lên đến 40Gbps) 1x HDMI 2.1 TMDS 1x Giắc cắm âm thanh kết hợp 3.5mm"
    },
    "rag_content": "Sản phẩm: Laptop ASUS Vivobook S14 S3407QA-SF043WS. Giá bán khoảng: 18,990,000 đồng. Cấu hình chi tiết: {\"Chip AI\": \"Qualcomm Hexagon NPU up to 45TOPS\", \"Loại card đồ họa\": \"Qualcomm Adreno GPU\", \"Dung lượng RAM\": \"16GB\", \"Loại RAM\": \"LPDDR5X Onboard\", \"Ổ cứng\": \"512GB M.2 NVMe PCIe 4.0 SSD\", \"Kích thước màn hình\": \"14 inches\", \"Công nghệ màn hình\": \"Độ sáng 300 nits Độ phủ màu 95% DCI-P3 Tỷ lệ tương phản 1.000.000:1 1.07 tỷ màu Màn hình chống chói giảm 70% ánh sáng xanh có hại Được chứng nhận bởi TÜV Rheinland\", \"Pin\": \"70WHrs, 3S1P, 3-cell Li-ion\", \"Hệ điều hành\": \"Windows 11 Home + Microsoft Office Home 2024 + Microsoft 365 Basic\", \"Độ phân giải màn hình\": \"1920 x 1200 pixels\", \"Loại CPU\": \"Snapdragon X X1 26 100 (30MB Cache, up to 2.97GHz, 8 lõi, 8 luồng)\", \"Cổng giao tiếp\": \"2x USB 3.2 Gen 1 Type-A (tốc độ dữ liệu lên đến 5Gbps) 2x USB 4.0 Gen 3 Type-C hỗ trợ hiển thị/cấp nguồn (tốc độ dữ liệu lên đến 40Gbps) 1x HDMI 2.1 TMDS 1x Giắc cắm âm thanh kết hợp 3.5mm\"}. Tính năng nổi bật: "
  },
  {
    "url": "https://cellphones.com.vn/laptop-asus-zenbook-14-um3406ka-pp113ws-ryzen-ai-7.html",
    "name": "Laptop ASUS Zenbook 14 UM3406KA-PP113WS",
    "price_int": 25990000,
    "category": "Laptop",
    "specs": {
      "Chip AI": "AMD XDNA™ NPU up to 50TOPS",
      "Loại card đồ họa": "AMD Radeon Graphics",
      "Dung lượng RAM": "16GB",
      "Loại RAM": "LPDDR5X",
      "Số khe ram": "Onboard",
      "Ổ cứng": "512GB M.2 NVMe PCIe 4.0 SSD",
      "Kích thước màn hình": "14 inches",
      "Công nghệ màn hình": "Độ sáng 400nits Độ sáng đỉnh HDR 600nits Độ phủ màu 100% DCI-P3 VESA CERTIFIED Display HDR True Black 600 1.07 tỷ màu Ánh sáng xanh ít gây hại hơn 70% TÜV Rheinland-certified SGS Eye Care Display",
      "Pin": "75WHrs, 4S1P, 4-cell Li-ion",
      "Hệ điều hành": "Windows 11 Home + Microsoft Office Home 2024 + Microsoft 365 Basic",
      "Độ phân giải màn hình": "2880 x 1800 pixels",
      "Loại CPU": "AMD Ryzen AI 7 350 2.0GHz (24MB Cache, up to 5.0GHz, 8 lõi, 16 luồng)",
      "Cổng giao tiếp": "1x USB 3.2 Gen 1 Type-A (5Gbps) 1x USB 3.2 Gen 2 Type-C hỗ trợ hiển thị/cung cấp điện (10Gbps) 1x USB 4.0 Gen 3 Type-C hỗ trợ hiển thị/cung cấp điện (40Gbps) 1x HDMI 2.1 TMDS 1x Giắc cắm âm thanh kết hợp 3.5mm"
    },
    "rag_content": "Sản phẩm: Laptop ASUS Zenbook 14 UM3406KA-PP113WS. Giá bán khoảng: 25,990,000 đồng. Cấu hình chi tiết: {\"Chip AI\": \"AMD XDNA™ NPU up to 50TOPS\", \"Loại card đồ họa\": \"AMD Radeon Graphics\", \"Dung lượng RAM\": \"16GB\", \"Loại RAM\": \"LPDDR5X\", \"Số khe ram\": \"Onboard\", \"Ổ cứng\": \"512GB M.2 NVMe PCIe 4.0 SSD\", \"Kích thước màn hình\": \"14 inches\", \"Công nghệ màn hình\": \"Độ sáng 400nits Độ sáng đỉnh HDR 600nits Độ phủ màu 100% DCI-P3 VESA CERTIFIED Display HDR True Black 600 1.07 tỷ màu Ánh sáng xanh ít gây hại hơn 70% TÜV Rheinland-certified SGS Eye Care Display\", \"Pin\": \"75WHrs, 4S1P, 4-cell Li-ion\", \"Hệ điều hành\": \"Windows 11 Home + Microsoft Office Home 2024 + Microsoft 365 Basic\", \"Độ phân giải màn hình\": \"2880 x 1800 pixels\", \"Loại CPU\": \"AMD Ryzen AI 7 350 2.0GHz (24MB Cache, up to 5.0GHz, 8 lõi, 16 luồng)\", \"Cổng giao tiếp\": \"1x USB 3.2 Gen 1 Type-A (5Gbps) 1x USB 3.2 Gen 2 Type-C hỗ trợ hiển thị/cung cấp điện (10Gbps) 1x USB 4.0 Gen 3 Type-C hỗ trợ hiển thị/cung cấp điện (40Gbps) 1x HDMI 2.1 TMDS 1x Giắc cắm âm thanh kết hợp 3.5mm\"}. Tính năng nổi bật: "
  },
  {
    "url": "https://cellphones.com.vn/laptop-asus-zenbook-a14-ux3407qa-qd299ws-copilot-x-plus.html",
    "name": "Laptop ASUS Zenbook A14 UX3407QA-QD299WS",
    "price_int": 26490000,
    "category": "Laptop",
    "specs": {
      "Chip AI": "Qualcomm Hexagon NPU up to 45TOPS",
      "Loại card đồ họa": "Qualcomm Adreno GPUTiến trình chip mới nên có thể không kết nối được với các thiết bị có driver cũ",
      "Dung lượng RAM": "16GB",
      "Loại RAM": "LPDDR5X",
      "Số khe ram": "Onboard",
      "Ổ cứng": "512GB M.2 NVMe PCIe 4.0 SSD",
      "Kích thước màn hình": "14 inches",
      "Công nghệ màn hình": "Thời gian phản hồi 0.2msĐộ sáng 400nitsĐộ sáng tối đa 600nits HDRĐộ phủ màu 100% DCI-P3 HDR True Black 6001.07 tỷ màuGiảm 70% ánh sáng xanh có hạiTÜV Rheinland-certifiedMàn hình chăm sóc mắt SGS",
      "Pin": "70WHrs, 3S1P, 3-cell Li-ion",
      "Hệ điều hành": "Windows 11 Home + Microsoft Office Home 2024 + Microsoft 365 Basic",
      "Độ phân giải màn hình": "1920 x 1200 pixels (WUXGA)",
      "Loại CPU": "Snapdragon X X1 26 100 (30MB Cache, up to 2.97GHz, 8 lõi, 8 luồng)",
      "Cổng giao tiếp": "1x USB 3.2 Gen 2 Type-A (10Gbps) 2x USB 4.0 Gen 3 Type-C hỗ trợ hiển thị/sạc (40Gbps) 1x HDMI 2.1 TMDS 1x Giắc cắm âm thanh kết hợp 3.5mm"
    },
    "rag_content": "Sản phẩm: Laptop ASUS Zenbook A14 UX3407QA-QD299WS. Giá bán khoảng: 26,490,000 đồng. Cấu hình chi tiết: {\"Chip AI\": \"Qualcomm Hexagon NPU up to 45TOPS\", \"Loại card đồ họa\": \"Qualcomm Adreno GPUTiến trình chip mới nên có thể không kết nối được với các thiết bị có driver cũ\", \"Dung lượng RAM\": \"16GB\", \"Loại RAM\": \"LPDDR5X\", \"Số khe ram\": \"Onboard\", \"Ổ cứng\": \"512GB M.2 NVMe PCIe 4.0 SSD\", \"Kích thước màn hình\": \"14 inches\", \"Công nghệ màn hình\": \"Thời gian phản hồi 0.2msĐộ sáng 400nitsĐộ sáng tối đa 600nits HDRĐộ phủ màu 100% DCI-P3 HDR True Black 6001.07 tỷ màuGiảm 70% ánh sáng xanh có hạiTÜV Rheinland-certifiedMàn hình chăm sóc mắt SGS\", \"Pin\": \"70WHrs, 3S1P, 3-cell Li-ion\", \"Hệ điều hành\": \"Windows 11 Home + Microsoft Office Home 2024 + Microsoft 365 Basic\", \"Độ phân giải màn hình\": \"1920 x 1200 pixels (WUXGA)\", \"Loại CPU\": \"Snapdragon X X1 26 100 (30MB Cache, up to 2.97GHz, 8 lõi, 8 luồng)\", \"Cổng giao tiếp\": \"1x USB 3.2 Gen 2 Type-A (10Gbps) 2x USB 4.0 Gen 3 Type-C hỗ trợ hiển thị/sạc (40Gbps) 1x HDMI 2.1 TMDS 1x Giắc cắm âm thanh kết hợp 3.5mm\"}. Tính năng nổi bật: "
  },
  {
    "url": "https://cellphones.com.vn/laptop-asus-zenbook-s-16-um5606ka-rk127ws-ryzen-ai-7.html",
    "name": "Laptop ASUS Zenbook S 16 UM5606KA-RK127WS",
    "price_int": 36990000,
    "category": "Laptop",
    "specs": {
      "Chip AI": "AMD XDNA NPU up to 50TOPS",
      "Loại card đồ họa": "AMD Radeon Graphics",
      "Dung lượng RAM": "24GB",
      "Loại RAM": "LPDDR5X Onboard",
      "Ổ cứng": "1TB M.2 NVMe PCIe 4.0 SSD",
      "Kích thước màn hình": "16 inches",
      "Công nghệ màn hình": "Thời gian phản hồi 0.2ms Độ sáng 400nits Độ sáng tối đa 500nits HDR Độ phủ màu 100% DCI-P3 HDR True Black 500 1.07 tỷ màu Giảm 70% ánh sáng xanh có hại TÜV Rheinland-certified SGS Eye Care Display",
      "Pin": "78WHrs, 2S2P, 4-cell Li-ion",
      "Hệ điều hành": "Windows 11 Home + Microsoft Office Home 2024 + Microsoft 365 Basic",
      "Độ phân giải màn hình": "2880 x 1800 pixels",
      "Loại CPU": "AMD Ryzen AI 7 350 2.0GHz (24MB Cache, up to 5.0GHz, 8 lõi, 16 luồng)",
      "Cổng giao tiếp": "1x USB 3.2 Gen 2 Type-A (10Gbps) 2x USB 4.0 Gen 3 Type-C hỗ trợ hiển thị/cung cấp điện (40Gbps) 1x HDMI 2.1 TMDS 1x Giắc cắm âm thanh kết hợp 3.5mm Đầu đọc thẻ SD 4.0"
    },
    "rag_content": "Sản phẩm: Laptop ASUS Zenbook S 16 UM5606KA-RK127WS. Giá bán khoảng: 36,990,000 đồng. Cấu hình chi tiết: {\"Chip AI\": \"AMD XDNA NPU up to 50TOPS\", \"Loại card đồ họa\": \"AMD Radeon Graphics\", \"Dung lượng RAM\": \"24GB\", \"Loại RAM\": \"LPDDR5X Onboard\", \"Ổ cứng\": \"1TB M.2 NVMe PCIe 4.0 SSD\", \"Kích thước màn hình\": \"16 inches\", \"Công nghệ màn hình\": \"Thời gian phản hồi 0.2ms Độ sáng 400nits Độ sáng tối đa 500nits HDR Độ phủ màu 100% DCI-P3 HDR True Black 500 1.07 tỷ màu Giảm 70% ánh sáng xanh có hại TÜV Rheinland-certified SGS Eye Care Display\", \"Pin\": \"78WHrs, 2S2P, 4-cell Li-ion\", \"Hệ điều hành\": \"Windows 11 Home + Microsoft Office Home 2024 + Microsoft 365 Basic\", \"Độ phân giải màn hình\": \"2880 x 1800 pixels\", \"Loại CPU\": \"AMD Ryzen AI 7 350 2.0GHz (24MB Cache, up to 5.0GHz, 8 lõi, 16 luồng)\", \"Cổng giao tiếp\": \"1x USB 3.2 Gen 2 Type-A (10Gbps) 2x USB 4.0 Gen 3 Type-C hỗ trợ hiển thị/cung cấp điện (40Gbps) 1x HDMI 2.1 TMDS 1x Giắc cắm âm thanh kết hợp 3.5mm Đầu đọc thẻ SD 4.0\"}. Tính năng nổi bật: "
  }
]